[
  {
    "id": "b65162df-359c-48a7-8aaf-8ceb80f529ea",
    "usuarioId": "58931b77-38bb-427d-be3e-e44fb9cf6dc2",
    "carrera": "Ingeniería Civil",
    "ciclo_actual": 8,
    "estado_matricula": "MATRICULADO",
    "creditos_aprobados": 32,
    "creditos_desaprobados": 16,
    "promedio_ponderado": 19.25,
    "historial_retirados": [],
    "avance_malla": 51.77,
    "cursos_reprobados": [],
    "asistencia_promedio": 68.46
  },
  {
    "id": "0890ec9d-8161-4de4-be23-29133af27d1f",
    "usuarioId": "1fcee0ab-e0a9-4c2b-bd3f-3cfe8eafa51d",
    "carrera": "Psicología",
    "ciclo_actual": 5,
    "estado_matricula": "RETIRADO",
    "creditos_aprobados": 111,
    "creditos_desaprobados": 3,
    "promedio_ponderado": 12.31,
    "historial_retirados": [],
    "avance_malla": 97.79,
    "cursos_reprobados": [],
    "asistencia_promedio": 77.12
  },
  {
    "id": "dc822fe6-fd4a-4801-9054-247b51bc133f",
    "usuarioId": "a0c06a21-57da-4577-b59d-97e94d2f20b8",
    "carrera": "Arquitectura",
    "ciclo_actual": 9,
    "estado_matricula": "EGRESADO",
    "creditos_aprobados": 211,
    "creditos_desaprobados": 3,
    "promedio_ponderado": 14.34,
    "historial_retirados": [],
    "avance_malla": 86.06,
    "cursos_reprobados": [],
    "asistencia_promedio": 93.57
  },
  {
    "id": "a9fa76c1-0dc5-4a00-8b31-dcc51e1136ba",
    "usuarioId": "947d8506-9f0f-4f99-9c45-a49ad25a181d",
    "carrera": "Ingeniería Civil",
    "ciclo_actual": 5,
    "estado_matricula": "EGRESADO",
    "creditos_aprobados": 156,
    "creditos_desaprobados": 11,
    "promedio_ponderado": 13.12,
    "historial_retirados": [],
    "avance_malla": 34.53,
    "cursos_reprobados": [],
    "asistencia_promedio": 94.69
  },
  {
    "id": "cd8f116e-246a-470f-b96b-9f09c6a68718",
    "usuarioId": "4a8ebe49-fca0-43fd-ba27-978ee6273ec8",
    "carrera": "Administración",
    "ciclo_actual": 9,
    "estado_matricula": "SUSPENDIDO",
    "creditos_aprobados": 43,
    "creditos_desaprobados": 17,
    "promedio_ponderado": 19.79,
    "historial_retirados": [],
    "avance_malla": 44.04,
    "cursos_reprobados": [],
    "asistencia_promedio": 76.62
  },
  {
    "id": "eec513b4-349c-4e95-9e72-a663907afe55",
    "usuarioId": "679fe297-323f-4840-bda1-236a926d1a96",
    "carrera": "Psicología",
    "ciclo_actual": 7,
    "estado_matricula": "SUSPENDIDO",
    "creditos_aprobados": 64,
    "creditos_desaprobados": 12,
    "promedio_ponderado": 12.82,
    "historial_retirados": [],
    "avance_malla": 13.08,
    "cursos_reprobados": [],
    "asistencia_promedio": 59.17
  },
  {
    "id": "360b048e-727c-4e7b-aacb-a871f3edb4ba",
    "usuarioId": "bf8429e7-b26d-493b-af84-11aac485d8be",
    "carrera": "Economía",
    "ciclo_actual": 6,
    "estado_matricula": "INACTIVO",
    "creditos_aprobados": 107,
    "creditos_desaprobados": 26,
    "promedio_ponderado": 12.57,
    "historial_retirados": [],
    "avance_malla": 20.39,
    "cursos_reprobados": [],
    "asistencia_promedio": 64.32
  },
  {
    "id": "599c65a4-148e-4625-b382-5ee2550cad7b",
    "usuarioId": "fe7e9b69-5f9e-4088-a431-5916564b1dc9",
    "carrera": "Psicología",
    "ciclo_actual": 10,
    "estado_matricula": "SUSPENDIDO",
    "creditos_aprobados": 99,
    "creditos_desaprobados": 2,
    "promedio_ponderado": 14.14,
    "historial_retirados": [],
    "avance_malla": 86.39,
    "cursos_reprobados": [
      "CUR493",
      "CUR477",
      "CUR271",
      "CUR290"
    ],
    "asistencia_promedio": 93.83
  },
  {
    "id": "c62d8139-b797-4bec-be1f-05f21eaef603",
    "usuarioId": "fffd4034-1d40-4011-8d45-f8f356a6ad38",
    "carrera": "Administración",
    "ciclo_actual": 4,
    "estado_matricula": "SUSPENDIDO",
    "creditos_aprobados": 230,
    "creditos_desaprobados": 16,
    "promedio_ponderado": 12.22,
    "historial_retirados": [],
    "avance_malla": 70.66,
    "cursos_reprobados": [],
    "asistencia_promedio": 54.4
  },
  {
    "id": "f81520ac-4ae6-4c6e-9040-528282e4df50",
    "usuarioId": "8424088a-e93d-41f4-88cb-7017f47f0dc2",
    "carrera": "Administración",
    "ciclo_actual": 5,
    "estado_matricula": "EGRESADO",
    "creditos_aprobados": 13,
    "creditos_desaprobados": 6,
    "promedio_ponderado": 14.6,
    "historial_retirados": [],
    "avance_malla": 50.14,
    "cursos_reprobados": [],
    "asistencia_promedio": 86.25
  },
  {
    "id": "74ef790a-a2ae-45df-aee6-d73aa31aa473",
    "usuarioId": "8a8a588b-f1c3-4e72-8dab-e0b5cc76e72f",
    "carrera": "Arquitectura",
    "ciclo_actual": 7,
    "estado_matricula": "EGRESADO",
    "creditos_aprobados": 171,
    "creditos_desaprobados": 7,
    "promedio_ponderado": 13.18,
    "historial_retirados": [],
    "avance_malla": 54.77,
    "cursos_reprobados": [],
    "asistencia_promedio": 91.1
  },
  {
    "id": "4cad2140-7b40-4920-9cd7-1608a8d1a780",
    "usuarioId": "3201b0ad-45f6-4970-9631-0851569c6eca",
    "carrera": "Ingeniería Civil",
    "ciclo_actual": 7,
    "estado_matricula": "INACTIVO",
    "creditos_aprobados": 165,
    "creditos_desaprobados": 30,
    "promedio_ponderado": 11.18,
    "historial_retirados": [],
    "avance_malla": 40.42,
    "cursos_reprobados": [],
    "asistencia_promedio": 75.26
  },
  {
    "id": "9440580e-0375-497b-8b65-eede2a566b48",
    "usuarioId": "8126d790-601d-4db4-bb6d-9d7971098a1b",
    "carrera": "Arquitectura",
    "ciclo_actual": 5,
    "estado_matricula": "EGRESADO",
    "creditos_aprobados": 25,
    "creditos_desaprobados": 22,
    "promedio_ponderado": 15.71,
    "historial_retirados": [],
    "avance_malla": 52.31,
    "cursos_reprobados": [],
    "asistencia_promedio": 83.74
  },
  {
    "id": "2e450535-a2b2-4cae-9cc5-12d7f10ed4dc",
    "usuarioId": "b6ea0f92-6250-4f2b-ab7d-31842b646f5d",
    "carrera": "Administración",
    "ciclo_actual": 5,
    "estado_matricula": "SUSPENDIDO",
    "creditos_aprobados": 33,
    "creditos_desaprobados": 22,
    "promedio_ponderado": 19.28,
    "historial_retirados": [],
    "avance_malla": 25.41,
    "cursos_reprobados": [],
    "asistencia_promedio": 83.01
  },
  {
    "id": "3d0b983f-64a7-4ec2-ac87-378341b46762",
    "usuarioId": "0281b583-988c-437b-ae1f-207c8dfd8654",
    "carrera": "Ingeniería de Software",
    "ciclo_actual": 7,
    "estado_matricula": "EGRESADO",
    "creditos_aprobados": 118,
    "creditos_desaprobados": 27,
    "promedio_ponderado": 11.52,
    "historial_retirados": [],
    "avance_malla": 91.84,
    "cursos_reprobados": [],
    "asistencia_promedio": 50.34
  },
  {
    "id": "c61598d3-1607-4c66-b503-597135222007",
    "usuarioId": "a03495c9-8b2a-4c22-80ce-4a3e44299dc8",
    "carrera": "Administración",
    "ciclo_actual": 8,
    "estado_matricula": "EGRESADO",
    "creditos_aprobados": 34,
    "creditos_desaprobados": 12,
    "promedio_ponderado": 12.63,
    "historial_retirados": [],
    "avance_malla": 60.01,
    "cursos_reprobados": [],
    "asistencia_promedio": 88.77
  },
  {
    "id": "d994dca3-29fb-4032-a97e-6267bf0a14bd",
    "usuarioId": "8ed8dfce-4f81-4b90-b021-38fe7b9370e0",
    "carrera": "Administración",
    "ciclo_actual": 4,
    "estado_matricula": "MATRICULADO",
    "creditos_aprobados": 100,
    "creditos_desaprobados": 20,
    "promedio_ponderado": 17.83,
    "historial_retirados": [],
    "avance_malla": 29.01,
    "cursos_reprobados": [],
    "asistencia_promedio": 88.78
  },
  {
    "id": "fc9f635d-d423-4e7b-a744-6b5614c9baec",
    "usuarioId": "9eeccad3-aa30-41e8-99d2-dc26a0356afd",
    "carrera": "Psicología",
    "ciclo_actual": 2,
    "estado_matricula": "SUSPENDIDO",
    "creditos_aprobados": 190,
    "creditos_desaprobados": 25,
    "promedio_ponderado": 11.54,
    "historial_retirados": [],
    "avance_malla": 83.8,
    "cursos_reprobados": [],
    "asistencia_promedio": 64.65
  },
  {
    "id": "6d914669-a7b5-4689-b18b-1aabe81e6680",
    "usuarioId": "01499e50-5382-4c63-b18d-06c679511872",
    "carrera": "Ingeniería de Software",
    "ciclo_actual": 11,
    "estado_matricula": "EGRESADO",
    "creditos_aprobados": 209,
    "creditos_desaprobados": 6,
    "promedio_ponderado": 17.98,
    "historial_retirados": [
      {
        "curso": "CUR208",
        "periodo": "2016-I"
      },
      {
        "curso": "CUR264",
        "periodo": "2019-II"
      }
    ],
    "avance_malla": 90.47,
    "cursos_reprobados": [],
    "asistencia_promedio": 84.98
  },
  {
    "id": "53a3ce1e-218a-4260-a4f7-d6a5b86b6d07",
    "usuarioId": "f1e38222-21d7-4493-9681-2d7015ecfbb1",
    "carrera": "Psicología",
    "ciclo_actual": 6,
    "estado_matricula": "SUSPENDIDO",
    "creditos_aprobados": 156,
    "creditos_desaprobados": 16,
    "promedio_ponderado": 17.87,
    "historial_retirados": [],
    "avance_malla": 14.47,
    "cursos_reprobados": [
      "CUR434",
      "CUR248",
      "CUR217"
    ],
    "asistencia_promedio": 55.61
  },
  {
    "id": "953e4257-d273-4594-8ff2-89b2941a03d9",
    "usuarioId": "cf848ac5-1d9b-4d18-8972-f0e2cc6d7fb9",
    "carrera": "Ingeniería de Software",
    "ciclo_actual": 5,
    "estado_matricula": "SUSPENDIDO",
    "creditos_aprobados": 110,
    "creditos_desaprobados": 2,
    "promedio_ponderado": 14.21,
    "historial_retirados": [],
    "avance_malla": 32.82,
    "cursos_reprobados": [],
    "asistencia_promedio": 91.16
  },
  {
    "id": "6ac3c5bd-3fed-4a7e-bee7-181cb5e79d10",
    "usuarioId": "8582030d-efb8-4caa-8b67-c685149253e7",
    "carrera": "Administración",
    "ciclo_actual": 3,
    "estado_matricula": "SUSPENDIDO",
    "creditos_aprobados": 2,
    "creditos_desaprobados": 8,
    "promedio_ponderado": 13.94,
    "historial_retirados": [],
    "avance_malla": 50.73,
    "cursos_reprobados": [],
    "asistencia_promedio": 75.75
  },
  {
    "id": "8f5ac027-4338-4529-8056-b54bd3e7028f",
    "usuarioId": "0e6934e3-9241-4fd6-bb68-d660039a88b0",
    "carrera": "Ingeniería Civil",
    "ciclo_actual": 6,
    "estado_matricula": "EGRESADO",
    "creditos_aprobados": 127,
    "creditos_desaprobados": 10,
    "promedio_ponderado": 14.09,
    "historial_retirados": [],
    "avance_malla": 5.44,